{
  "meta": {
    "extendedOptions": false,
    "extendedArcTypes": false,
    "extendedFeatures": false
  },
  "options": {
    "width": "300",
    "wordwraparcs": true
  },
  "entities": [
    {
      "name": "a"
    },
    {
      "name": "b space"
    },
    {
      "name": "c",
      "label": "aap noot mies wim zus jet\nteun vuur gijs lam kees bok"
    }
  ],
  "arcs": [
    [
      {
        "kind": "=>",
        "from": "a",
        "to": "b space",
        "label": "a simple script",
        "url": "http://github.com/sverweij/mscgen_js",
        "id": "1",
        "arcskip": "1"
      }
    ],
    [
      {
        "kind": "---",
        "linecolor": "green"
      }
    ],
    [
      {
        "kind": ":>",
        "from": "c",
        "to": "c",
        "label": "double your funk",
        "linecolor": "green"
      }
    ],
    [
      {
        "kind": "=>>",
        "from": "c",
        "to": "c",
        "label": "single file",
        "linecolor": "#123456"
      }
    ]
  ]
}
