{
  "precomment": [
    "/*\n * one row arcskips, with row height > normal row height; caused by current arc\n */",
    "\n"
  ],
  "meta": {
    "extendedOptions": false,
    "extendedArcTypes": false,
    "extendedFeatures": false
  },
  "options": {
    "wordwraparcs": true
  },
  "entities": [
    {
      "name": "a"
    },
    {
      "name": "b"
    },
    {
      "name": "c"
    }
  ],
  "arcs": [
    [
      {
        "kind": "---"
      },
      {
        "kind": "->",
        "from": "a",
        "to": "b",
        "arcskip": "1.5",
        "label": "arcskip = 1, this arc makes that the arc row height is heigher than the default archeight"
      }
    ],
    [
      {
        "kind": "---"
      },
      {
        "kind": "->",
        "from": "b",
        "to": "c",
        "label": "arcskip arc should connect to this"
      }
    ]
  ]
}