{
  "precomment": [
    "/*\n- 1/2 row arcskip, with a row height <= normal row height\n */",
    "\n"
  ],
  "meta": {
    "extendedOptions": false,
    "extendedArcTypes": false,
    "extendedFeatures": false
  },
  "options": {
    "wordwraparcs": true
  },
  "entities": [
    {
      "name": "a"
    },
    {
      "name": "b"
    },
    {
      "name": "c"
    }
  ],
  "arcs": [
    [
      {
        "kind": "---"
      },
      {
        "kind": "->",
        "from": "a",
        "to": "b",
        "arcskip": "0.5",
        "label": "arcskip = 0.5"
      }
    ],
    [
      {
        "kind": "---"
      },
      {
        "kind": "->",
        "from": "b",
        "to": "c",
        "label": "should land somewhere halfway above"
      }
    ]
  ]
}