{
  "precomment": [
    "/*\n- one row arcskip, with a row height <= normal row height within an inline expression\n */",
    "\n"
  ],
  "meta": {
    "extendedOptions": false,
    "extendedArcTypes": true,
    "extendedFeatures": true
  },
  "options": {
    "wordwraparcs": true
  },
  "entities": [
    {
      "name": "a"
    },
    {
      "name": "b"
    },
    {
      "name": "c"
    }
  ],
  "arcs": [
    [
      {
        "kind": "opt",
        "from": "a",
        "to": "c",
        "arcs": [
          [
            {
              "kind": "---"
            },
            {
              "kind": "->",
              "from": "a",
              "to": "b",
              "arcskip": "1",
              "label": "arcskip = 1"
            }
          ],
          [
            {
              "kind": "---"
            },
            {
              "kind": "->",
              "from": "b",
              "to": "c",
              "label": "arcskip arc should connect to this"
            }
          ]
        ],
        "label": "optional all of thisd"
      }
    ]
  ]
}
